{
  "$schema": "https://json-schema.org/draft/2020-12/schema",
  "$id": "https://schemas.meshrix.example/schemas/release-definition.schema.json",
  "title": "Meshrix.js Release Definition",
  "type": "object",
  "required": [
    "$schema",
    "version",
    "product",
    "release",
        "packages",
        "container",
    "acceptance",
    "github",
    "localVerification"
  ],
  "properties": {
    "$schema": {
      "type": "string"
    },
    "version": {
      "type": "string",
      "minLength": 1
    },
    "product": {
      "const": "Meshrix.js"
    },
    "release": {
      "type": "object",
      "required": [
        "version",
        "tag",
        "channel"
      ],
      "properties": {
        "version": {
          "type": "string",
          "pattern": "^(0|[1-9][0-9]*)\\.(0|[1-9][0-9]*)\\.(0|[1-9][0-9]*)(?:-[0-9A-Za-z-]+(?:\\.[0-9A-Za-z-]+)*)?$"
        },
        "tag": {
          "type": "string",
          "pattern": "^v[0-9]+\\.[0-9]+\\.[0-9]+(?:-[0-9A-Za-z-]+(?:\\.[0-9A-Za-z-]+)*)?$"
        },
        "channel": {
          "enum": [
            "stable",
            "next"
          ]
        }
      },
      "additionalProperties": false
    },
    "packages": {
      "type": "object",
      "required": [
        "manifests"
      ],
      "properties": {
        "manifests": {
          "type": "array",
          "minItems": 1,
          "uniqueItems": true,
          "items": {
            "type": "string",
            "pattern": "^(?!/)(?!.*(?:^|/)\\.\\.(?:/|$)).+/package\\.json$|^package\\.json$"
          }
        }
      },
      "additionalProperties": false
    },
    "container": {
      "type": "object",
      "required": [
        "target",
        "requiredForRelease"
      ],
      "properties": {
        "target": {
          "const": "runtime-ui"
        },
        "requiredForRelease": {
          "const": false
        }
      },
      "additionalProperties": false
    },
    "acceptance": {
      "type": "object",
      "required": [
        "profile",
        "commandId",
        "stableRequiredClaim",
        "releaseRequiredClaim",
        "standardsRegistry"
      ],
      "properties": {
        "profile": {
          "const": "single-node"
        },
        "commandId": {
          "const": "platform-acceptance"
        },
        "stableRequiredClaim": {
          "const": "functional-complete"
        },
        "releaseRequiredClaim": {
          "const": "npm-package-installability-passed"
        },
        "standardsRegistry": {
          "const": "tools/registry/release-acceptance-standards.registry.json"
        }
      },
      "additionalProperties": false
    },
    "github": {
      "type": "object",
      "required": [
        "environment",
        "nodeVersion",
        "npmCliVersion"
      ],
      "properties": {
        "environment": {
          "const": "release-candidate"
        },
        "nodeVersion": {
          "type": "string",
          "pattern": "^24\\.[0-9]+\\.[0-9]+$"
        },
        "npmCliVersion": {
          "type": "string",
          "pattern": "^(0|[1-9][0-9]*)\\.(0|[1-9][0-9]*)\\.(0|[1-9][0-9]*)$"
        }
      },
      "additionalProperties": false
    },
    "localVerification": {
      "type": "object",
      "required": [
        "engine",
        "evidenceAuthority"
      ],
      "properties": {
        "engine": {
          "const": "automatic-local"
        },
        "evidenceAuthority": {
          "const": "local-only"
        }
      },
      "additionalProperties": false
    }
  },
  "additionalProperties": false
}
