{
  "$schema": "./schema/release-definition.schema.json",
  "version": "v0.0.1:registry:release-definition-1",
  "product": "Meshrix.js",
  "release": {
    "version": "0.2.0",
    "tag": "v0.2.0",
    "channel": "stable"
  },
  "packages": {
    "manifests": [
      "package.json",
      "packages/contracts/package.json",
      "packages/entry-transport/package.json",
      "packages/gateway/package.json",
      "packages/foundation/package.json",
      "packages/peer-crypto/package.json",
      "packages/peer-client/package.json",
      "packages/agents/package.json",
      "packages/capabilities/package.json",
      "packages/client-adapter-kit/package.json",
      "packages/protocols/package.json",
      "packages/server-runtime/package.json",
      "packages/ui-console/package.json",
      "plugins/agents/antigravity/package.json",
      "plugins/agents/claude-code/package.json",
      "plugins/agents/codex/package.json",
      "plugins/agents/kimi/package.json",
      "plugins/agents/meshrix-self-maintenance/package.json",
      "plugins/agents/openclaw/package.json",
      "plugins/agents/opencode/package.json",
      "plugins/agents/pi/package.json",
      "apps/server/package.json",
      "apps/mcp-gateway-installer/package.json",
      "apps/entry/package.json",
      "apps/console/package.json"
    ]
  },
  "container": {
    "target": "runtime-ui",
    "requiredForRelease": false
  },
  "acceptance": {
    "profile": "single-node",
    "commandId": "platform-acceptance",
    "stableRequiredClaim": "functional-complete",
    "releaseRequiredClaim": "npm-package-installability-passed",
    "standardsRegistry": "tools/registry/release-acceptance-standards.registry.json"
  },
  "github": {
    "environment": "release-candidate",
    "nodeVersion": "24.21.0",
    "npmCliVersion": "11.21.0"
  },
  "localVerification": {
    "engine": "automatic-local",
    "evidenceAuthority": "local-only"
  }
}
